{
  "updated_at": "2026-03-20T23:48:11Z",
  "article_count": 406,
  "methodology_url": "/metodologia",
  "disclaimer_pt": "Análise algorítmica do tom das notícias coletadas. Não representa pesquisa de opinião.",
  "disclaimer_en": "Algorithmic analysis of collected news tone. Does not represent opinion polling.",
  "by_topic": {
    "aldo-rebelo": {
      "eleicoes": -0.05
    },
    "caiado": {
      "corrupcao": 0.4,
      "economia": 1.0,
      "educacao": 0.15,
      "eleicoes": 0.25,
      "impostos": 0.3,
      "indigenas": 0.3,
      "lgbtq": 0.3,
      "meio_ambiente": 0.7667,
      "midia": 0.29,
      "politica_ext": 0.3286,
      "saude": 0.65,
      "seguranca": 0.3
    },
    "eduardo-leite": {
      "corrupcao": 1.0,
      "educacao": 1.0,
      "eleicoes": 0.19,
      "politica_ext": 0.6667
    },
    "flavio-bolsonaro": {
      "corrupcao": -0.0656,
      "economia": 0.4364,
      "educacao": 0.45,
      "eleicoes": 0.0217,
      "impostos": 0.425,
      "indigenas": 0.45,
      "lgbtq": -0.3,
      "meio_ambiente": 0.3333,
      "midia": -0.2848,
      "politica_ext": 0.031,
      "previdencia": 0.15,
      "privatizacao": 0.1,
      "saude": 0.2875,
      "seguranca": 0.0864
    },
    "lula": {
      "armas": 0.2333,
      "corrupcao": -0.0758,
      "economia": 0.1422,
      "educacao": 0.515,
      "eleicoes": 0.1094,
      "impostos": 0.1095,
      "indigenas": 0.4,
      "lgbtq": 0.1231,
      "meio_ambiente": 0.3846,
      "midia": 0.0914,
      "politica_ext": 0.1,
      "previdencia": 0.1429,
      "privatizacao": 0.4444,
      "saude": 0.2,
      "seguranca": 0.12
    },
    "ratinho-jr": {
      "eleicoes": 0.1,
      "midia": 0.1,
      "politica_ext": 0.1
    },
    "renan-santos": {
      "corrupcao": 0.0,
      "eleicoes": -0.0167,
      "midia": 0.1,
      "politica_ext": 0.0
    },
    "tarcisio": {
      "corrupcao": -0.0182,
      "economia": -0.35,
      "educacao": -0.1,
      "eleicoes": -0.1917,
      "impostos": -0.2533,
      "indigenas": -1.0,
      "meio_ambiente": -0.2778,
      "midia": -0.4,
      "politica_ext": -0.1077,
      "privatizacao": -0.0556,
      "saude": 0.05,
      "seguranca": -0.0571
    },
    "zema": {
      "corrupcao": -0.6167,
      "economia": 0.6,
      "educacao": 0.6,
      "eleicoes": -0.0536,
      "midia": -0.65,
      "politica_ext": 0.1273
    }
  },
  "by_source": {
    "aldo-rebelo": {
      "magazine": -0.05
    },
    "caiado": {
      "institutional": 0.15,
      "international": 0.3,
      "magazine": 0.1417,
      "mainstream": 0.2,
      "party": 0.3,
      "politics": 0.3222
    },
    "eduardo-leite": {
      "magazine": -0.025,
      "mainstream": 0.6667,
      "politics": 0.0
    },
    "flavio-bolsonaro": {
      "institutional": -0.225,
      "international": -0.1,
      "magazine": 0.0098,
      "mainstream": 0.1096,
      "politics": -0.0103
    },
    "lula": {
      "institutional": 0.1833,
      "international": 0.1,
      "magazine": 0.1085,
      "mainstream": 0.0307,
      "politics": 0.2222
    },
    "ratinho-jr": {
      "mainstream": 0.1
    },
    "renan-santos": {
      "magazine": -0.05,
      "politics": 0.0
    },
    "tarcisio": {
      "magazine": -0.22,
      "mainstream": -0.248,
      "politics": 0.0833
    },
    "zema": {
      "magazine": -0.075,
      "mainstream": 0.1,
      "politics": -0.125
    }
  }
}
