{
  "updated_at": "2026-10-10T18:51:25Z",
  "article_count": 191,
  "methodology_url": "/metodologia",
  "disclaimer_pt": "Análise algorítmica do tom das notícias coletadas. Não representa pesquisa de opinião.",
  "disclaimer_en": "Algorithmic analysis of collected news tone. Does not represent opinion polling.",
  "by_topic": {
    "augusto-cury": {
      "armas": 0.2,
      "corrupcao": 0.2,
      "economia": 0.1333,
      "educacao": 0.1333,
      "eleicoes": 0.11,
      "impostos": 0.2,
      "midia": 0.16,
      "politica_externa": 0.18,
      "previdencia": 0.2333,
      "privatizacao": 0.1667,
      "saude": 0.125,
      "seguranca": 0.1
    },
    "caiado": {
      "armas": -0.1,
      "corrupcao": 0.1,
      "educacao": 0.1,
      "eleicoes": -0.0,
      "impostos": 0.1,
      "midia": -0.05,
      "politica_externa": 0.1,
      "previdencia": -0.1,
      "privatizacao": -0.1,
      "saude": 0.1,
      "seguranca": 0.1
    },
    "flavio-bolsonaro": {
      "armas": -0.16,
      "corrupcao": -0.0682,
      "economia": 0.0352,
      "educacao": -0.0654,
      "eleicoes": -0.0225,
      "impostos": 0.0565,
      "lgbtq": -0.3,
      "meio_ambiente": -0.4,
      "midia": -0.0526,
      "politica_externa": 0.0054,
      "previdencia": 0.0158,
      "privatizacao": 0.225,
      "saude": -0.025,
      "seguranca": -0.025
    },
    "lula": {
      "armas": 0.2,
      "corrupcao": 0.0262,
      "economia": 0.109,
      "educacao": 0.1367,
      "eleicoes": 0.0983,
      "impostos": 0.0771,
      "indigenas": 0.1,
      "lgbtq": 0.6,
      "meio_ambiente": 0.1,
      "midia": 0.068,
      "politica_externa": 0.1487,
      "previdencia": 0.1118,
      "privatizacao": -0.2167,
      "saude": 0.1475,
      "seguranca": 0.1333
    },
    "pablo-marcal": {
      "economia": -0.4,
      "eleicoes": -0.4,
      "midia": -0.4
    },
    "renan-santos": {
      "corrupcao": 0.1,
      "economia": -0.3,
      "educacao": -0.1,
      "eleicoes": 0.04,
      "impostos": -0.3,
      "midia": -0.15,
      "politica_externa": 0.1,
      "previdencia": -0.3,
      "saude": -0.1,
      "seguranca": 0.1
    },
    "tarcisio": {
      "corrupcao": 0.1,
      "educacao": 0.1,
      "eleicoes": 0.1,
      "midia": 0.1,
      "politica_externa": 0.1,
      "saude": 0.1,
      "seguranca": 0.1
    },
    "zema": {
      "armas": -0.3,
      "corrupcao": -0.3,
      "economia": -0.2,
      "educacao": -0.2,
      "eleicoes": -0.2,
      "impostos": -0.25,
      "midia": -0.3,
      "politica_externa": -0.3,
      "previdencia": -0.25,
      "privatizacao": -0.3,
      "saude": -0.2
    }
  },
  "by_source": {
    "augusto-cury": {
      "institutional": 0.15,
      "international": 0.2,
      "magazine": -0.1,
      "mainstream": 0.15,
      "politics": 0.0667
    },
    "caiado": {
      "international": -0.1,
      "magazine": -0.1,
      "mainstream": 0.1,
      "politics": 0.0333
    },
    "flavio-bolsonaro": {
      "institutional": 0.1667,
      "international": -0.0125,
      "magazine": 0.0312,
      "mainstream": -0.0468,
      "politics": -0.0275
    },
    "lula": {
      "institutional": 0.35,
      "international": -0.0667,
      "magazine": 0.1333,
      "mainstream": 0.089,
      "politics": 0.0442
    },
    "pablo-marcal": {
      "politics": -0.4
    },
    "renan-santos": {
      "magazine": -0.1,
      "mainstream": -0.1667,
      "politics": 0.25
    },
    "tarcisio": {
      "mainstream": 0.1
    },
    "zema": {
      "international": -0.3,
      "magazine": -0.1,
      "mainstream": -0.2,
      "politics": -0.2
    }
  }
}
