{
  "updated_at": "2026-03-09T16:10:00Z",
  "article_count": 0,
  "methodology_url": "/metodologia",
  "disclaimer_pt": "Análise algorítmica do tom das notícias coletadas. Não representa pesquisa de opinião.",
  "disclaimer_en": "Algorithmic analysis of collected news tone. Does not represent opinion polling.",
  "by_topic": {},
  "by_source": {}
}
